{
  "$schema": "https://json-schema.org/draft/2020-12/schema",
  "$id": "https://github.com/OpenCoven/coven-github/docs/contracts/result.schema.json",
  "title": "coven-code headless result envelope",
  "description": "Terminal task state coven-code --headless writes to --output. Contract version 2.",
  "type": "object",
  "additionalProperties": false,
  "required": ["contract_version", "status", "commits", "files_changed", "summary", "pr_body", "review"],
  "properties": {
    "contract_version": {
      "type": "string",
      "const": "2"
    },
    "status": {
      "type": "string",
      "enum": ["success", "failure", "partial", "needs_input"]
    },
    "branch": {
      "type": ["string", "null"]
    },
    "commits": {
      "type": "array",
      "items": {
        "type": "object",
        "additionalProperties": false,
        "required": ["sha", "message"],
        "properties": {
          "sha": { "type": "string" },
          "message": { "type": "string" }
        }
      }
    },
    "files_changed": {
      "type": "array",
      "items": { "type": "string" }
    },
    "summary": { "type": "string" },
    "pr_body": { "type": "string" },
    "review": {
      "type": "object",
      "additionalProperties": false,
      "required": [
        "mode",
        "evidence_status",
        "reviewed_files",
        "supporting_files",
        "findings",
        "tests_run",
        "no_findings_reason",
        "limitations"
      ],
      "properties": {
        "mode": {
          "type": "string",
          "enum": ["none", "pull_request", "review_comment"]
        },
        "evidence_status": {
          "type": "string",
          "enum": ["not_applicable", "complete", "partial", "missing"]
        },
        "reviewed_files": {
          "type": "array",
          "items": { "type": "string" }
        },
        "supporting_files": {
          "type": "array",
          "items": { "type": "string" }
        },
        "findings": {
          "type": "array",
          "items": {
            "type": "object",
            "additionalProperties": false,
            "required": ["severity", "file", "line", "title", "body", "recommendation"],
            "properties": {
              "severity": {
                "type": "string",
                "enum": ["info", "low", "medium", "high", "critical"]
              },
              "file": { "type": "string" },
              "line": { "type": ["integer", "null"], "minimum": 1 },
              "title": { "type": "string" },
              "body": { "type": "string" },
              "recommendation": { "type": ["string", "null"] }
            }
          }
        },
        "tests_run": {
          "type": "array",
          "items": {
            "type": "object",
            "additionalProperties": false,
            "required": ["command", "status", "output_summary"],
            "properties": {
              "command": { "type": "string" },
              "status": {
                "type": "string",
                "enum": ["passed", "failed", "not_run", "unknown"]
              },
              "output_summary": { "type": ["string", "null"] }
            }
          }
        },
        "no_findings_reason": { "type": ["string", "null"] },
        "limitations": {
          "type": "array",
          "items": { "type": "string" }
        }
      },
      "allOf": [
        {
          "if": {
            "properties": { "mode": { "enum": ["pull_request", "review_comment"] } },
            "required": ["mode"]
          },
          "then": {
            "properties": {
              "evidence_status": {
                "enum": ["complete", "partial", "missing"]
              }
            },
            "anyOf": [
              { "properties": { "reviewed_files": { "minItems": 1 } }, "required": ["reviewed_files"] },
              { "properties": { "evidence_status": { "const": "missing" } }, "required": ["evidence_status"] }
            ],
            "oneOf": [
              { "properties": { "findings": { "minItems": 1 } }, "required": ["findings"] },
              {
                "properties": {
                  "no_findings_reason": { "type": "string", "minLength": 1 }
                },
                "required": ["no_findings_reason"]
              }
            ]
          }
        },
        {
          "if": {
            "properties": { "mode": { "const": "none" } },
            "required": ["mode"]
          },
          "then": {
            "properties": {
              "evidence_status": { "const": "not_applicable" }
            },
            "required": ["evidence_status"]
          }
        }
      ]
    },
    "exit_reason": {
      "type": ["string", "null"],
      "enum": ["test_failure", "ambiguous_spec", "git_conflict", "infra_error", null]
    }
  }
}
